business_id,name,rating,review_count,category,address,city,zip_code,review_text,review_rating
J6ge-0l4EFj5pXuPQRj58g,Bouillon Pigalle,3.6,160,French,22 boulevard Clichy,Paris,75018,"Went for lunch and got lucky, walk in line was inside the door. Place was packed and like the French, they take their time to eat. A lot of stories and...",5
J6ge-0l4EFj5pXuPQRj58g,Bouillon Pigalle,3.6,160,French,22 boulevard Clichy,Paris,75018,"Waited in line for almost 45 minutes or so to get in but the food was actually pretty good. 

Our server was actually very, very rushed and essentially just...",4
J6ge-0l4EFj5pXuPQRj58g,Bouillon Pigalle,3.6,160,French,22 boulevard Clichy,Paris,75018,"TOURIST TRAP. Applebees of Paris. Normal people and Paris first timers, I beg you... do not go here. Their reviews are paid for the restaurant to...",1
J6ge-0l4EFj5pXuPQRj58g,Bouillon Pigalle,3.6,160,French,22 boulevard Clichy,Paris,75018,"Very busy restaurant so it was good that we made reservations in advance. 

I ordered the pork shoulder with porcini mushrooms and sarladaise potatoes. Some...",3
g9ig7BLxpOXCkV1577dz5A,Picotte,4.9,8,"French, Tapas Bars",42 rue de Malte,Paris,75012,"Amazing food and service beautiful plates and very creative chef thank you so much definitely will come back.
5 stars whoops",5
g9ig7BLxpOXCkV1577dz5A,Picotte,4.9,8,"French, Tapas Bars",42 rue de Malte,Paris,75012,"First time to Paris and we stayed around the corner from Picotte, which we found while walking around.  We are so happy we came in.  The food was fresh and...",5
g9ig7BLxpOXCkV1577dz5A,Picotte,4.9,8,"French, Tapas Bars",42 rue de Malte,Paris,75012,Love the environment and food is very fresh. Very unique experience! We ordered the meat and croquettes and were A++,5
g9ig7BLxpOXCkV1577dz5A,Picotte,4.9,8,"French, Tapas Bars",42 rue de Malte,Paris,75012,Great food with a great service definitely a good place to come to you when you were looking for authentic French food.We came here and had the salmon with...,5
g9ig7BLxpOXCkV1577dz5A,Picotte,4.9,8,"French, Tapas Bars",42 rue de Malte,Paris,75012,"What a fun dining experience! Our hotel recommended this restaurant, and we are so glad we went. Such a cozy atmosphere and incredibly friendly service. The...",4
g9ig7BLxpOXCkV1577dz5A,Picotte,4.9,8,"French, Tapas Bars",42 rue de Malte,Paris,75012,A great restaurant. Very good food. Great atmosphere. Vegetarian friendly. Enjoyed each and every thing we've tried. Menu in French and English,5
g9ig7BLxpOXCkV1577dz5A,Picotte,4.9,8,"French, Tapas Bars",42 rue de Malte,Paris,75012,Delicious small plates from different regions of France.,5
0v26s2eIC20M_vTnwqyHPg,La Boîte aux Lettres,4.8,62,French,108 rue Lepic,Paris,75018,"La Boîte aux Lettres, which translates to ""the mailbox,"" is in such a charming location with a wonderful, helpful, and good-looking staff (bonus!). The...",5
0v26s2eIC20M_vTnwqyHPg,La Boîte aux Lettres,4.8,62,French,108 rue Lepic,Paris,75018,Would have probably been a good restaurant but you need to watch the servers if you don't have reservations otherwise they won't bother telling you if it's...,1
0v26s2eIC20M_vTnwqyHPg,La Boîte aux Lettres,4.8,62,French,108 rue Lepic,Paris,75018,"Had an absolutely incredible dining experience here thanks to Talia and the rest of the staff. Hospitality was wonderful, offering first if I would prefer...",5
0v26s2eIC20M_vTnwqyHPg,La Boîte aux Lettres,4.8,62,French,108 rue Lepic,Paris,75018,Amazing food! Happened upon here because we wanted a lunch and this place had some good reviews. So worth it! Love their menu with rotations and sets and...,5
0v26s2eIC20M_vTnwqyHPg,La Boîte aux Lettres,4.8,62,French,108 rue Lepic,Paris,75018,"We found this place when our cab dropped us off at the wrong place. A busy lunch crowd , we had to wait a few minutes and I'm so glad we did! The food was...",5
0v26s2eIC20M_vTnwqyHPg,La Boîte aux Lettres,4.8,62,French,108 rue Lepic,Paris,75018,"A restaurant that knows how to make flavors takes any of the dishes to a much higher level than normal or fantastic! 
I was lucky during my trip to Paris to...",5
0v26s2eIC20M_vTnwqyHPg,La Boîte aux Lettres,4.8,62,French,108 rue Lepic,Paris,75018,Fabulous! Exactly the experience we wanted on our final night in Paris... I love Montmartre but wanted to steer clear of the tourist traps on the main...,5
Mv_tdcgeN9Ox2Jju-ai0vA,Brasserie Dubillot,4.3,22,"Brasseries, French",222 Rue Saint-Denis,Paris,75002,We came here for lunch without a reservation as a party of 3 and all had a great time at the colorful and warm Brasserie Dubillot located on Rue Saint-Denis...,5
Mv_tdcgeN9Ox2Jju-ai0vA,Brasserie Dubillot,4.3,22,"Brasseries, French",222 Rue Saint-Denis,Paris,75002,Great quality food and service . Everything was on point ! We don't have any reservations but the host took us in and we were given a lovely center table....,5
Mv_tdcgeN9Ox2Jju-ai0vA,Brasserie Dubillot,4.3,22,"Brasseries, French",222 Rue Saint-Denis,Paris,75002,"Food was fine, service was very sub par.  Really quite bad, actually.  I had hoped to go back and try some other dishes, but will not, now.  There are too...",3
Mv_tdcgeN9Ox2Jju-ai0vA,Brasserie Dubillot,4.3,22,"Brasseries, French",222 Rue Saint-Denis,Paris,75002,"Great meal, great experience!  Quaint French restaurant with excellent service.  French Onion soup and oysters were terrific",5
Mv_tdcgeN9Ox2Jju-ai0vA,Brasserie Dubillot,4.3,22,"Brasseries, French",222 Rue Saint-Denis,Paris,75002,Brasserie Dubillot is a busy and exciting place for deliciously authentic French cuisine. 5/5 service. The servers are all so kind and polite and make sure...,5
Mv_tdcgeN9Ox2Jju-ai0vA,Brasserie Dubillot,4.3,22,"Brasseries, French",222 Rue Saint-Denis,Paris,75002,"Loved these apps. Eggs were amazing and the soup was great too! Not pictured was steak tartare for my main, it was amazing. Service was great. Outside vibes...",4
Mv_tdcgeN9Ox2Jju-ai0vA,Brasserie Dubillot,4.3,22,"Brasseries, French",222 Rue Saint-Denis,Paris,75002,Beautiful Parisian atmosphere.. from the walls to the food  & staff was amazing! Natives actually dine here which was a plus! 10/10 & shoutout to my friend...,5
9ACptOR-HKm38LCwSXILgA,Les Bains - La Salle à Manger,5.0,2,French,7 rue du Bourg l'Abbé,Paris,75003,AMAZING PLACE! We went for brunch but cant wait to go for dinner! The place GORGEOUS. FOOD EXCELLENT W ATTENTION PAID TO ORGANIC! If you want to go to a...,5
9ACptOR-HKm38LCwSXILgA,Les Bains - La Salle à Manger,5.0,2,French,7 rue du Bourg l'Abbé,Paris,75003,"One of the best dinners we have ever had. Lamb was unbelievable, pork belly was delicious. Decent wine selection. Fun atmosphere. Friendly, helpful service.",5
qUThvsx5WzdF8exm4ReyVg,Chez Gabrielle,4.7,75,French,7 rue de l'Etoile,Paris,75017,"Perfect small restaurant ~30 seats. Took our jackets and we sat down for one of the best meals of the trip. Our table had steak, scallops, and veal with a...",5
qUThvsx5WzdF8exm4ReyVg,Chez Gabrielle,4.7,75,French,7 rue de l'Etoile,Paris,75017,"First things first -- the owner is awesome.
We didn't have a reservation on a Friday and called right when they opened. She barely squeezed us in, and...",3
qUThvsx5WzdF8exm4ReyVg,Chez Gabrielle,4.7,75,French,7 rue de l'Etoile,Paris,75017,"We had a wonderful meal here this evening. This is a very small quiet restaurant but the staff was amazing!

We highly recommend it!",5
qUThvsx5WzdF8exm4ReyVg,Chez Gabrielle,4.7,75,French,7 rue de l'Etoile,Paris,75017,"If you can get reservations, do!   This is a small (10 table) cozy restaurant with incredible food and service.  Next time we are in Paris we will be back.",5
qUThvsx5WzdF8exm4ReyVg,Chez Gabrielle,4.7,75,French,7 rue de l'Etoile,Paris,75017,Chez Gabrielle is tucked away on a side street near the Arc de Triumph and it's a true jewel.  We had a wonderful dinner in this cozy little bistro on a...,5
qUThvsx5WzdF8exm4ReyVg,Chez Gabrielle,4.7,75,French,7 rue de l'Etoile,Paris,75017,Great time to be had at CG!   So many factors weighed into this but I will try ever so hard to describe this beautiful journey so you don't miss out....,5
qUThvsx5WzdF8exm4ReyVg,Chez Gabrielle,4.7,75,French,7 rue de l'Etoile,Paris,75017,Chez Gabrielle is a hidden gem near The Arc de' Triomphe where a meal is an escape into an otherworldly cuisine experience. I finished a memorable dinner...,5
657yy3D4SwyQN3xIjG1Iww,Le Potager du Père Thierry,4.6,499,French,16 rue des Trois Frères,Paris,75018,"Had this spot bookmarked and I don't remember why so we booked a reservation at 7 Saturday night.  

So cozy (you will meet your neighbor) that we asked to...",5
657yy3D4SwyQN3xIjG1Iww,Le Potager du Père Thierry,4.6,499,French,16 rue des Trois Frères,Paris,75018,"We were exploring the Montmartre neighborhood in the late afternoon, so we decided to stay in the area for dinner too. I had this spot bookmarked (can't...",4
657yy3D4SwyQN3xIjG1Iww,Le Potager du Père Thierry,4.6,499,French,16 rue des Trois Frères,Paris,75018,Everything was good. Thank you to my Yelp reviews to find this jewel!! This was the first time having foie gras and it was very flavorful with excellent...,5
657yy3D4SwyQN3xIjG1Iww,Le Potager du Père Thierry,4.6,499,French,16 rue des Trois Frères,Paris,75018,"Two weeks in France! You'd think I'd have planned better than I actually did! But Yelp helped me wing it with restaurant and attraction reviews. 
This...",4
657yy3D4SwyQN3xIjG1Iww,Le Potager du Père Thierry,4.6,499,French,16 rue des Trois Frères,Paris,75018,Found this place because of the good reviews and called ahead to make a reservation. We started with the french onion soup and baked egg with foie gras. The...,5
657yy3D4SwyQN3xIjG1Iww,Le Potager du Père Thierry,4.6,499,French,16 rue des Trois Frères,Paris,75018,"This is the second time I have gone and they don't disappoint. The servers are so kind, professional and accommodating. The food is delicious. Their wine is...",5
657yy3D4SwyQN3xIjG1Iww,Le Potager du Père Thierry,4.6,499,French,16 rue des Trois Frères,Paris,75018,"I found Potager on a list of the best crème brûlée places in Paris. In that regard it did not disappoint.

Potager is small. Less than 20 people got inside...",5
eKBoT4coMRZdGmgHZuKHaw,Le Petit Médicis,4.4,20,French,13 rue de Médicis,Paris,75006,We found this restaurant on the map as well as told by other patrons that this was their top restaurant to go to every time they were in paris. Say less!...,5
eKBoT4coMRZdGmgHZuKHaw,Le Petit Médicis,4.4,20,French,13 rue de Médicis,Paris,75006,"Every Dish was perfect. Foie Gras tasted spectacularly freshly made.
White Asparagus so nicely done.
Generous portion of Beef Tartare, delicately seasoned...",5
eKBoT4coMRZdGmgHZuKHaw,Le Petit Médicis,4.4,20,French,13 rue de Médicis,Paris,75006,This restaurant was absolutely awesome.  The pork head patte was amazing and our main courses were as well.  Servers were very nice and accommodating.  We...,5
eKBoT4coMRZdGmgHZuKHaw,Le Petit Médicis,4.4,20,French,13 rue de Médicis,Paris,75006,"My favorite meal in Paris...so far! A very cute and small restaurant on a busy street near the park, I picked this one because the menu seemed to have the...",5
eKBoT4coMRZdGmgHZuKHaw,Le Petit Médicis,4.4,20,French,13 rue de Médicis,Paris,75006,"Just left this charming restaurant after having a wonderful dinner. The escargot beef terrine veal chop and duck confit were all excellent 
 How the owner...",5
eKBoT4coMRZdGmgHZuKHaw,Le Petit Médicis,4.4,20,French,13 rue de Médicis,Paris,75006,After visiting the Luxembourg gardens we were in need of some good grub. There are many places to eat around the area and we found this place. We had a...,5
eKBoT4coMRZdGmgHZuKHaw,Le Petit Médicis,4.4,20,French,13 rue de Médicis,Paris,75006,Wow. Flew into Paris late and after dropping our bags off at the Air Bnb by Jardin du Luxembourg our host recommended this spot. We squeezed into the only...,5
v5Noospim4MQhncZRpCuCA,Le Petit Marché,4.3,120,French,9 rue Béarn,Paris,75003,Cool upscale spot in an interesting neighborhood with a bustling yet cozy vibe. While they don't have an english menu the staff is accommodative towards...,5
v5Noospim4MQhncZRpCuCA,Le Petit Marché,4.3,120,French,9 rue Béarn,Paris,75003,Staying nearby with my just graduated from university son this restaurant popped up as a great place and the reviews are spot on!  From the moment we...,5
v5Noospim4MQhncZRpCuCA,Le Petit Marché,4.3,120,French,9 rue Béarn,Paris,75003,Must go in Paris!! An amazing place where the food is authentic while the servers and staff are very welcoming to non-Parisians. Love their complimentary...,5
v5Noospim4MQhncZRpCuCA,Le Petit Marché,4.3,120,French,9 rue Béarn,Paris,75003,"One of my favorite spots to eat in the Marais. Cozy, unassuming atmosphere, wonderful food, and friendly service. It's a classy little neighborhood hangout...",5
v5Noospim4MQhncZRpCuCA,Le Petit Marché,4.3,120,French,9 rue Béarn,Paris,75003,"Thankfully our Concierge recommended this neighborhood gem while we were recently in Paris.  We had a great table with a fantastic server, who helped us...",5
v5Noospim4MQhncZRpCuCA,Le Petit Marché,4.3,120,French,9 rue Béarn,Paris,75003,By far my favorite restaurant every-time I come to Paris! I've been coming with my family for over 8 years and it has always been so amazing! The staff is...,5
v5Noospim4MQhncZRpCuCA,Le Petit Marché,4.3,120,French,9 rue Béarn,Paris,75003,The duck was soooo good. I ate there many years ago and still think about it. Hope to make my way back to Paris and try it again!,5
RH5bqc88_M4izFoaPoTW0g,La Grange aux Canards,4.4,26,French,23 rue Frédéric Sauton,Paris,75005,One of the best restaurants I've dined in Paris. The staff was very friendly and the food was amazing. They are very famous for their duck dishes so make...,5
RH5bqc88_M4izFoaPoTW0g,La Grange aux Canards,4.4,26,French,23 rue Frédéric Sauton,Paris,75005,It's permanently closed. No service whatsoever.  Food tasted of city air. AND it was raining. I'll never go back to this place again.,1
RH5bqc88_M4izFoaPoTW0g,La Grange aux Canards,4.4,26,French,23 rue Frédéric Sauton,Paris,75005,Started with the foie gras and escargot. The foie gras was decent but probably the worst of all the ones I had during my time in Paris. The escargot was...,3
RH5bqc88_M4izFoaPoTW0g,La Grange aux Canards,4.4,26,French,23 rue Frédéric Sauton,Paris,75005,I actually didn't know that duck would be such a staple in France. I grew up with Peking duck and it's always been a childhood favorite so it was...,5
RH5bqc88_M4izFoaPoTW0g,La Grange aux Canards,4.4,26,French,23 rue Frédéric Sauton,Paris,75005,Des plats délicieux et un acceuil très sympa. J'aimais beaucoup mon canard à l'orange et le polenta était parfait. J'ai aussi volé presque toutes les pommes...,5
RH5bqc88_M4izFoaPoTW0g,La Grange aux Canards,4.4,26,French,23 rue Frédéric Sauton,Paris,75005,Cool spot. The duck breast was great. The lemon cheesecake was my favorite dessert I had in Paris.,5
RH5bqc88_M4izFoaPoTW0g,La Grange aux Canards,4.4,26,French,23 rue Frédéric Sauton,Paris,75005,"Best duck restaurant ever and upon exiting the restaurant, I told the server to pass on to the chef that I almost felt like in heaven! On my checklist for...",5
AKjVaoytS_XrHBPX7iJeBQ,Au Bon Accueil,4.5,93,French,14 rue Monttessuy,Paris,75007,"This was our most memorable meal and I cannot believe I never wrote a review for it. Well 6 years later isn't too late... probably.

I remember finding this...",5
AKjVaoytS_XrHBPX7iJeBQ,Au Bon Accueil,4.5,93,French,14 rue Monttessuy,Paris,75007,"Absolument incroyable is how we felt about our entire dining experience at this Michelin, Bib Gourmand restaurant!  We walked in pretty late in the evening...",5
AKjVaoytS_XrHBPX7iJeBQ,Au Bon Accueil,4.5,93,French,14 rue Monttessuy,Paris,75007,Wonderful restaurant close to the Eiffel Tower! Lovely service. We ordered from the fixed menu and felt it was a great value for the quality of food. Highly...,5
AKjVaoytS_XrHBPX7iJeBQ,Au Bon Accueil,4.5,93,French,14 rue Monttessuy,Paris,75007,"What a great experience and I'm so glad I picked this restaurant for the night.

Food and service were both great! Wine selection were excellent. Desert...",5
AKjVaoytS_XrHBPX7iJeBQ,Au Bon Accueil,4.5,93,French,14 rue Monttessuy,Paris,75007,A beautiful restaurant not far from the Eiffel Tower.  We went there for dinner last week and had a marvelous experience.  Service is excellent and the food...,5
AKjVaoytS_XrHBPX7iJeBQ,Au Bon Accueil,4.5,93,French,14 rue Monttessuy,Paris,75007,If you're in Paris and want Romaric Erving make sure to make reservations here! We ordered from the prix fix menu. Everything was phenomenal. Staff was...,5
AKjVaoytS_XrHBPX7iJeBQ,Au Bon Accueil,4.5,93,French,14 rue Monttessuy,Paris,75007,"Such an amazing restaurant and one of the best dining views of the Eiffel Tower in the city!!! 


You will need a reservation to dine here as many walk ins...",5
ePu3Me3SA4lVM-wGzKk0xA,Le Bistro Lyonnais,4.4,34,French,6 rue Michel Chasles,Paris,75012,"The fish Tartar the salad dressing on there was delicious... my friends liked the fish sea bass.... There is happy hour at five pm 

Tiramisu was really...",4
ePu3Me3SA4lVM-wGzKk0xA,Le Bistro Lyonnais,4.4,34,French,6 rue Michel Chasles,Paris,75012,"We concluded our Paris trip with a nice dinner. This is a friendly bistro located in Paris.  

The waiters are welcoming and friendly. They all speak...",5
ePu3Me3SA4lVM-wGzKk0xA,Le Bistro Lyonnais,4.4,34,French,6 rue Michel Chasles,Paris,75012,"Tasty French food in a casual and quaint setting. We were looking for something to eat close to our hotel. Looking at the reviews, we decided to give this a...",5
ePu3Me3SA4lVM-wGzKk0xA,Le Bistro Lyonnais,4.4,34,French,6 rue Michel Chasles,Paris,75012,"I agree with the other reviews. The service was great. Yes the one waiter speaks excellent english. I went there for the french onion soup, which was great....",5
ePu3Me3SA4lVM-wGzKk0xA,Le Bistro Lyonnais,4.4,34,French,6 rue Michel Chasles,Paris,75012,"Recommended by the Hilton property we were staying at.

Very traditional French bistro in both decor and menu options. We started with a Picon Biere which...",4
ePu3Me3SA4lVM-wGzKk0xA,Le Bistro Lyonnais,4.4,34,French,6 rue Michel Chasles,Paris,75012,"Great service, amazing food and perfect place to enjoy an amazing meal while visiting Paris.  We were in town for the Olympics and Lauren took phenomenal...",5
ePu3Me3SA4lVM-wGzKk0xA,Le Bistro Lyonnais,4.4,34,French,6 rue Michel Chasles,Paris,75012,A first visit to Paris and a first visit to Le Bistro Lyonnais. At 9:00 pm we were greeted by a friendly proprietor who spoke broken English (which we...,4
NzeX7PR81NRNA0O2Kz-YUQ,L'Atelier de Joël Robuchon,4.1,428,"French, Modern European",5 rue de Montalembert,Paris,75007,"We came here on our last night in Paris.  I called late, 8pm to see if they had room for the 4 of us at 9:30pm.  The answer was yes, we could be squeezed in...",1
NzeX7PR81NRNA0O2Kz-YUQ,L'Atelier de Joël Robuchon,4.1,428,"French, Modern European",5 rue de Montalembert,Paris,75007,A+++ dinner on Rue Montalabert.  I sat at the bar as a solo diner at L'Atelier Joel Robuchon and ate one of the best dinners ever.  Service was impeccable -...,5
NzeX7PR81NRNA0O2Kz-YUQ,L'Atelier de Joël Robuchon,4.1,428,"French, Modern European",5 rue de Montalembert,Paris,75007,Very fine dining!!! Wow!! Warmly greeted upon arrival by the doorman and seated immediately! The decor was very upscale and warm! Nice decorations and art....,5
NzeX7PR81NRNA0O2Kz-YUQ,L'Atelier de Joël Robuchon,4.1,428,"French, Modern European",5 rue de Montalembert,Paris,75007,"Food was amazing. Enjoyed every second. Sat at bar, Benjamin waited on me and was super knowledgeable about what wine to pair with food. 
Very delicious and...",5
NzeX7PR81NRNA0O2Kz-YUQ,L'Atelier de Joël Robuchon,4.1,428,"French, Modern European",5 rue de Montalembert,Paris,75007,"Very similar to the one in Vegas. I was a party of one and chose the second latest reso available. Had a wonderful meal. Wasn't flawless, but I don't...",5
NzeX7PR81NRNA0O2Kz-YUQ,L'Atelier de Joël Robuchon,4.1,428,"French, Modern European",5 rue de Montalembert,Paris,75007,If you are expecting a Las Vegas Robuchon experience where everything is impeccable. Please go elsewhere. When you enter and the maiter'de has no sport coat...,1
NzeX7PR81NRNA0O2Kz-YUQ,L'Atelier de Joël Robuchon,4.1,428,"French, Modern European",5 rue de Montalembert,Paris,75007,"I had dinner yesterday night at the restaurant in Saint-Germain , since it was next to our hotel we had planned ahead and made a reservation at 9...",3
4EO7AmtGKhrecEo0NtmU7Q,Café de la Régence,4.1,59,French,167 rue Saint-Honoré,Paris,75001,"Near The l'ouvre Museum. Has a charming, outdoor seating, but with pedestrian traffic, it actually was a mess. People were knocking into tables and it was...",2
4EO7AmtGKhrecEo0NtmU7Q,Café de la Régence,4.1,59,French,167 rue Saint-Honoré,Paris,75001,"Great location and area,friendly service. We enjoyed the food, Escargot is tasty, chicken and duck properly seasoned and cooked. Overall great dining experience",5
4EO7AmtGKhrecEo0NtmU7Q,Café de la Régence,4.1,59,French,167 rue Saint-Honoré,Paris,75001,"Food, service, and ambience were all fantastic. Highly recommend if you're in the area. Traditional Parisienne menu and vibe.",5
4EO7AmtGKhrecEo0NtmU7Q,Café de la Régence,4.1,59,French,167 rue Saint-Honoré,Paris,75001,"Great cafe/bistro in the center of Paris. You can sit inside or street side, but outside is the best. Beautiful architecture to view and people to talk...",5
4EO7AmtGKhrecEo0NtmU7Q,Café de la Régence,4.1,59,French,167 rue Saint-Honoré,Paris,75001,"This was also a lovely little quintessentially French patio restaurant. I  speak a little French but the waiter, I think was messing with me, or trying to...",4
4EO7AmtGKhrecEo0NtmU7Q,Café de la Régence,4.1,59,French,167 rue Saint-Honoré,Paris,75001,"Very cute little French cafe.  I had a delicious salmon pasta.  
My husband had tartare.  
The wine and people watching were my favorite part.  
Waiter was...",5
4EO7AmtGKhrecEo0NtmU7Q,Café de la Régence,4.1,59,French,167 rue Saint-Honoré,Paris,75001,"Atmosphere, food and service were all top notch. The French onion soup as a starter was delicious. The salmon poke bowl and pasta with chicken were both...",5
h1o8V9ltj_OpFw8YQDpVzw,Au Bistrot de la Montagne,4.3,10,"French, Venues & Event Spaces",38 rue Montagne Sainte-Geneviève,Paris,75005,"Want the best french onion soup ever?! Go here. NOW.  And the escargot?! I never thought I'd enjoy eating snails, but wow. Best thing I've ever eaten in...",5
h1o8V9ltj_OpFw8YQDpVzw,Au Bistrot de la Montagne,4.3,10,"French, Venues & Event Spaces",38 rue Montagne Sainte-Geneviève,Paris,75005,Tried to go to this place  but it was closed despite both the website and Yelp both saying it was open.,1
h1o8V9ltj_OpFw8YQDpVzw,Au Bistrot de la Montagne,4.3,10,"French, Venues & Event Spaces",38 rue Montagne Sainte-Geneviève,Paris,75005,"So if you eat french onion soup in France.. is it still called french onion soup or just onion soup? Anyways.. hands down, being a girl from America... this...",4
h1o8V9ltj_OpFw8YQDpVzw,Au Bistrot de la Montagne,4.3,10,"French, Venues & Event Spaces",38 rue Montagne Sainte-Geneviève,Paris,75005,"Despite being generally rather let down by Paris' food compared to other French cities I visited, this first meal I ever ate in France was the best I had in...",4
h1o8V9ltj_OpFw8YQDpVzw,Au Bistrot de la Montagne,4.3,10,"French, Venues & Event Spaces",38 rue Montagne Sainte-Geneviève,Paris,75005,This place is amazing! The people are nice and food the food was to die for! If I had the money I would fly here just to eat at this restaurant! MMmmmm...,5
h1o8V9ltj_OpFw8YQDpVzw,Au Bistrot de la Montagne,4.3,10,"French, Venues & Event Spaces",38 rue Montagne Sainte-Geneviève,Paris,75005,We were on a coach trip to Paris 2 years ago now and this was an optional outing. We thought that 35 Euros for a 3 course meal with bottomless wine we...,4
h1o8V9ltj_OpFw8YQDpVzw,Au Bistrot de la Montagne,4.3,10,"French, Venues & Event Spaces",38 rue Montagne Sainte-Geneviève,Paris,75005,Great restaurant if you're traveling to here for the full French food experience! There were several men playing accordion and guitar for entertainment with...,5
hnCLffW_PtwlcMDCN_ArIQ,L'Olivier du Marais,4.8,5,French,16 place des Vosges,Paris,75004,"3 Star food, 5 Star price. The food is not bad & not wonderful. Strait forward simple dishes, and if you do the €10 set (main dish and dessert - both real...",4
hnCLffW_PtwlcMDCN_ArIQ,L'Olivier du Marais,4.8,5,French,16 place des Vosges,Paris,75004,"A delightful french bistro with delicious food. For lunch, the goat cheese tomato sandwich was recommended by the maitre d and it was delectable. Location,...",5
hnCLffW_PtwlcMDCN_ArIQ,L'Olivier du Marais,4.8,5,French,16 place des Vosges,Paris,75004,Absolutely exceptional experience. Food was on point and the staff were exceptionally pleasant. A true gem.,5
gd-E3jJ8WGOcFz-LAhAhAw,Café New York,4.5,21,French,6 avenue de New York,Paris,75016,The location was perfect The food was well presented The very professional staff tended to us with humour and class,5
gd-E3jJ8WGOcFz-LAhAhAw,Café New York,4.5,21,French,6 avenue de New York,Paris,75016,Absolute lovely place to eat! Indoor and outdoor seating in perfect view of the Eiffel Tower. Food was very good! Food Came out quickly but they didn't rush...,5
gd-E3jJ8WGOcFz-LAhAhAw,Café New York,4.5,21,French,6 avenue de New York,Paris,75016,"We thoroughly enjoyed our meal & the ambiance of the restaurant. The servers were friendly and the fellow diners made the restaurant feel lively. 

The...",4
