business_id,name,rating,review_count,category,address,city,zip_code,review_text,review_rating
prbkmBK8Uv_UMSBklrNpMQ,Au Vieux Comptoir,4.1,54,French,17 rue des Lavandières-Sainte-Opportune,Paris,75001,My friend who is a Paris local took me here when I asked for a good traditional French dinner. Although they have a selection of only 6 wines and no...,5
prbkmBK8Uv_UMSBklrNpMQ,Au Vieux Comptoir,4.1,54,French,17 rue des Lavandières-Sainte-Opportune,Paris,75001,"We went here after seeing some sights.  The food was good and out kids found something that they liked.  

It is close to Notre Dame and several river...",3
coG7MrFUyZUxybC2S8fHFQ,La Rôtisserie d'Argent,4.0,106,"French, Rotisserie Chicken",19 quai de la Tournelle,Paris,75005,We arrived at noon and were given a lovely table facing the Seine. The person greeting us and our waiter couldn't have been nicer and more welcoming. Out of...,5
coG7MrFUyZUxybC2S8fHFQ,La Rôtisserie d'Argent,4.0,106,"French, Rotisserie Chicken",19 quai de la Tournelle,Paris,75005,"Great service and great food in a classic French bistro atmosphere. The duck confit was delicious, as were the potatoes it came with. Our party also tried...",4
coG7MrFUyZUxybC2S8fHFQ,La Rôtisserie d'Argent,4.0,106,"French, Rotisserie Chicken",19 quai de la Tournelle,Paris,75005,"Our family had a wonderful weekday lunch at La Rotisserie d'Argent. Everyone was very kind to our grandchildren, every course was delicious, the wine...",5
coG7MrFUyZUxybC2S8fHFQ,La Rôtisserie d'Argent,4.0,106,"French, Rotisserie Chicken",19 quai de la Tournelle,Paris,75005,"Walking into the restaurant that was recommended by a friend, I immediately thought ""tourist trap"" judging by the fact that everyone was American. Inside...",3
coG7MrFUyZUxybC2S8fHFQ,La Rôtisserie d'Argent,4.0,106,"French, Rotisserie Chicken",19 quai de la Tournelle,Paris,75005,We enjoyed dinner at La Rotisserie during our last night in Paris. A bistro associated with the adjacent Michelin-starred Tour D'Argent (currently closed...,5
coG7MrFUyZUxybC2S8fHFQ,La Rôtisserie d'Argent,4.0,106,"French, Rotisserie Chicken",19 quai de la Tournelle,Paris,75005,"It's amazing how many people on Google keep associating this place with La Tour Da Argent across the street. Myself included, which is how I wound up...",3
coG7MrFUyZUxybC2S8fHFQ,La Rôtisserie d'Argent,4.0,106,"French, Rotisserie Chicken",19 quai de la Tournelle,Paris,75005,Great service and good food. The noisey atmosphere is not for everyone but the delicious food sure is.,5
sgc5fGdiYfOmq8sTeyG3Kw,Café Saint-Régis,4.1,211,"French, Breakfast & Brunch",6 rue Jean du Bellay,Paris,75004,"Fresh and delicious food. We had an omelette, crape, fresh juice, tea and a cappuccino. The service was quick and very good. The ambiance is relaxing and warm.",5
sgc5fGdiYfOmq8sTeyG3Kw,Café Saint-Régis,4.1,211,"French, Breakfast & Brunch",6 rue Jean du Bellay,Paris,75004,"Cafe Saint-Regis has got a great location near Notre Dame. We came here for lunch on a Monday, and it was packed! We waited about 15 minutes for a table....",4
sgc5fGdiYfOmq8sTeyG3Kw,Café Saint-Régis,4.1,211,"French, Breakfast & Brunch",6 rue Jean du Bellay,Paris,75004,"I stopped in with my friend for a late lunch around 3 pm and was promptly seated at a cute table next to the wall. 
We started out with the escargot and the...",5
sgc5fGdiYfOmq8sTeyG3Kw,Café Saint-Régis,4.1,211,"French, Breakfast & Brunch",6 rue Jean du Bellay,Paris,75004,Eggs Benedict was delicious.  I was happy to get bacon in Paris!  The orange juice is delicious as well.,4
sgc5fGdiYfOmq8sTeyG3Kw,Café Saint-Régis,4.1,211,"French, Breakfast & Brunch",6 rue Jean du Bellay,Paris,75004,This place was on my list of places to try and this was my favorite meal of my entire trip. Mushroom risotto that was so creamy and hands down the best...,5
sgc5fGdiYfOmq8sTeyG3Kw,Café Saint-Régis,4.1,211,"French, Breakfast & Brunch",6 rue Jean du Bellay,Paris,75004,"Café St Regis is the most perfect café for a Parisian breakfast. Due to the rain, I dined inside and felt like I was living out a romanticized dream. A...",5
sgc5fGdiYfOmq8sTeyG3Kw,Café Saint-Régis,4.1,211,"French, Breakfast & Brunch",6 rue Jean du Bellay,Paris,75004,"I had read that Café St Régis was one of the best breakfast spots in Paris and luckily it was nearby my AirBnB and Notre Dame. 

It's the traditional corner...",5
MN-I5rJBYAZwp2jeHXs_JQ,L'Alsacien,4.7,69,"Beer Bar, Wine Bars, Alsatian",6 rue Saint-Bon,Paris,75004,Perhaps one of my favorite meals in two weeks of eating out in Paris. We came just as the restaurant opened and we're given a seat as there were no...,5
MN-I5rJBYAZwp2jeHXs_JQ,L'Alsacien,4.7,69,"Beer Bar, Wine Bars, Alsatian",6 rue Saint-Bon,Paris,75004,"My ancestors are from the Alsace region, and I was excited to come across this place and be able to try to traditional food. The ambiance was cute, and the...",5
MN-I5rJBYAZwp2jeHXs_JQ,L'Alsacien,4.7,69,"Beer Bar, Wine Bars, Alsatian",6 rue Saint-Bon,Paris,75004,"A ton of promise, with a scrumptious Alsatian flammekuche to stave off the biting wet cold, but ultimately, there were a few missteps.

Our charcuterie...",3
MN-I5rJBYAZwp2jeHXs_JQ,L'Alsacien,4.7,69,"Beer Bar, Wine Bars, Alsatian",6 rue Saint-Bon,Paris,75004,"Amazingly cute and cozy restaurant that will blow you away with something different than your standard French cuisine. The specialty here is flammekueche, a...",5
MN-I5rJBYAZwp2jeHXs_JQ,L'Alsacien,4.7,69,"Beer Bar, Wine Bars, Alsatian",6 rue Saint-Bon,Paris,75004,Phenomenal food and drinks!  We were on vacation in Paris and on this particular day (Aug16) we had been sightseeing around Notre Dame and wanted some good...,5
MN-I5rJBYAZwp2jeHXs_JQ,L'Alsacien,4.7,69,"Beer Bar, Wine Bars, Alsatian",6 rue Saint-Bon,Paris,75004,Stopped here for dinner on our first night in gai Paris. We stayed in the the 5th arrondissements  and walked across the Seine to the 1rst to satiate my...,5
MN-I5rJBYAZwp2jeHXs_JQ,L'Alsacien,4.7,69,"Beer Bar, Wine Bars, Alsatian",6 rue Saint-Bon,Paris,75004,"Not impressed. I don't see why this place is rated 5 stars. Had the flammekueche which was the best thing i had there, really light and simple taste, the...",3
-YKc0e0z_47s8JeXA2feOg,La Tour de Montlhéry ou chez Denise,3.8,122,French,5 rue Prouvaires,Paris,75001,Food was so good. I got the duck confit and she got a steak with fries on the side. My duck was crunchy on the outside but moist on the inside. The ceramic...,4
-YKc0e0z_47s8JeXA2feOg,La Tour de Montlhéry ou chez Denise,3.8,122,French,5 rue Prouvaires,Paris,75001,"Maybe I ordered the wrong dish, but I got steak (actually, we all got steak), cooked medium (I order medium rare in the US and find that medium in France is...",3
-YKc0e0z_47s8JeXA2feOg,La Tour de Montlhéry ou chez Denise,3.8,122,French,5 rue Prouvaires,Paris,75001,"Great place to taste the French food .
They are a large menu in order to make everyone happy 
serving was good and friendly 
thank you",4
-YKc0e0z_47s8JeXA2feOg,La Tour de Montlhéry ou chez Denise,3.8,122,French,5 rue Prouvaires,Paris,75001,"Worst food ever!!! It's better to go to fast restaurants. After ordering a food, it took less than 10 minutes!!! How can you cook steak and everything in...",1
-YKc0e0z_47s8JeXA2feOg,La Tour de Montlhéry ou chez Denise,3.8,122,French,5 rue Prouvaires,Paris,75001,"Two days into my trip to Paris I started getting worried. The food was generally quite disappointing. This is Paris! Every meal should be amazing. 
I was...",5
-YKc0e0z_47s8JeXA2feOg,La Tour de Montlhéry ou chez Denise,3.8,122,French,5 rue Prouvaires,Paris,75001,"This is essentially and  old-school, meat and potatoes type of place.   Though they do have fish, duck, rabbit, and  interesting daily specials and so on....",4
-YKc0e0z_47s8JeXA2feOg,La Tour de Montlhéry ou chez Denise,3.8,122,French,5 rue Prouvaires,Paris,75001,"Historic Bistro in Les Halles

We had been wanting to try this place since Boudain's first episode of No Reservations, ""Why the French Don't Suck.""

 Nice,...",4
9s_6-zeLtobYHy28M9ccMQ,Les Routiers,4.4,33,"French, Bistros",50 bis rue Marx Dormoy,Paris,75018,"We Found this gem of a place on our last trip and wouldn't miss it on this trip. The staff was terrific, and the food was so delicious. Everything from the...",5
9s_6-zeLtobYHy28M9ccMQ,Les Routiers,4.4,33,"French, Bistros",50 bis rue Marx Dormoy,Paris,75018,"Unassuming and gallantly sitting nestled in Goutte d'Or, you'll find perfectly cooked succulent steaks, andouille and entrecote at Les Routiers. Most people...",5
9s_6-zeLtobYHy28M9ccMQ,Les Routiers,4.4,33,"French, Bistros",50 bis rue Marx Dormoy,Paris,75018,"Top Notch BISTRO food, with humongus portions. Rare hidden gem in Paris, Home made Andouillette is quite something...",5
9s_6-zeLtobYHy28M9ccMQ,Les Routiers,4.4,33,"French, Bistros",50 bis rue Marx Dormoy,Paris,75018,"Underrated and understated. 

Great local food that requires you to walk in with no bourgeoisie expectations. 

Get the fois gras and fries. I would highly...",5
9s_6-zeLtobYHy28M9ccMQ,Les Routiers,4.4,33,"French, Bistros",50 bis rue Marx Dormoy,Paris,75018,"Set in an away from the center, immigrant neighborhood, Les Routiers is NOT tourist oriented, NOT decorated in the beaux arts manner, and NOT pricey. 

We...",5
9s_6-zeLtobYHy28M9ccMQ,Les Routiers,4.4,33,"French, Bistros",50 bis rue Marx Dormoy,Paris,75018,First day in Paris and the perfect place for our first Dinner! We were assured by a local couple sitting next to us that we had true authentic great food...,5
9s_6-zeLtobYHy28M9ccMQ,Les Routiers,4.4,33,"French, Bistros",50 bis rue Marx Dormoy,Paris,75018,The clientele was very inappropriate.  They were being very rude about tourists.  I would never eat at this place again.  It was one of the worst...,1
Df7eNm_K1CwYy4E18vRzFw,Zébulon,4.4,27,"Bistros, Modern European, French",10 rue de Richelieu,Paris,75001,"The food was absolutely wonderful. My friend and I came from America looking for unique dishes, they were soooo well done and flavorful. Every thing was...",5
Df7eNm_K1CwYy4E18vRzFw,Zébulon,4.4,27,"Bistros, Modern European, French",10 rue de Richelieu,Paris,75001,"Menu in the pictures. Advice from one American to anyone visiting Paris, France, this is a jewel you shouldn't overlook. 

It's not far from the Louvre...",5
Df7eNm_K1CwYy4E18vRzFw,Zébulon,4.4,27,"Bistros, Modern European, French",10 rue de Richelieu,Paris,75001,My wife and I ate at Zebulon on a trip to Paris.  It wasn't far from our hotel and was on the Michelin Guide website.  Wow did this place taste fantastic!...,4
Df7eNm_K1CwYy4E18vRzFw,Zébulon,4.4,27,"Bistros, Modern European, French",10 rue de Richelieu,Paris,75001,"Wow, what a wonderful place.  We had a 
 fabulous modern french dinner, at this lovely, happy, and non-touristy restaurant.
We each did the 3 course menu....",5
Df7eNm_K1CwYy4E18vRzFw,Zébulon,4.4,27,"Bistros, Modern European, French",10 rue de Richelieu,Paris,75001,"Did a walking tour today.  Stumble across at 8pm.  With no reservation, they totally took care of me.
I order the tasting/set menu and asked my server to...",5
Df7eNm_K1CwYy4E18vRzFw,Zébulon,4.4,27,"Bistros, Modern European, French",10 rue de Richelieu,Paris,75001,There are many choices in Paris. This is a good one. Great food and service. Make sure you bring good company with you.,5
Df7eNm_K1CwYy4E18vRzFw,Zébulon,4.4,27,"Bistros, Modern European, French",10 rue de Richelieu,Paris,75001,"The food, the wine, the food.  Ee stunled upon this treasure looking for another restaurant.  We walked in at 8pm with no reservation and thankfully they...",5
Y9olNhl_2mLe-pex8Y5qiQ,La Petite Chaise,4.2,80,"French, Brasseries",36 rue Grenelle,Paris,75007,"Old school charm!

La Petite Chaise made my last night in Paris magnificent.  A last minute reservation for a table of 8 was accepted   by the staff who...",5
Y9olNhl_2mLe-pex8Y5qiQ,La Petite Chaise,4.2,80,"French, Brasseries",36 rue Grenelle,Paris,75007,For the oldest restaurant in Paris I was expecting a bit more. They were kind enough to sit us without a reservation as it was early in the evening (right...,4
Y9olNhl_2mLe-pex8Y5qiQ,La Petite Chaise,4.2,80,"French, Brasseries",36 rue Grenelle,Paris,75007,"The oldest restaurant in Paris, Founded in 1680 !

The restaurant takes its name from the transformation of an old French word ""cheze"" of latin origin, casa...",4
Y9olNhl_2mLe-pex8Y5qiQ,La Petite Chaise,4.2,80,"French, Brasseries",36 rue Grenelle,Paris,75007,Wow! This was one of the BEST restaurant I went to. All the staff is so kind and speaks there best english to help you understand. I would recommend this to...,5
Y9olNhl_2mLe-pex8Y5qiQ,La Petite Chaise,4.2,80,"French, Brasseries",36 rue Grenelle,Paris,75007,Claimed to be one of the oldest restaurants in Paris. Tried their set menu for dinner. I started off with poached eggs with bacon in wine sauce. It was...,4
Y9olNhl_2mLe-pex8Y5qiQ,La Petite Chaise,4.2,80,"French, Brasseries",36 rue Grenelle,Paris,75007,"The oldest restaurant in Paris didn't disappoint! We walked in without a reservation (two people) right after opening, but I've heard you'll usually need to...",4
Y9olNhl_2mLe-pex8Y5qiQ,La Petite Chaise,4.2,80,"French, Brasseries",36 rue Grenelle,Paris,75007,"Nice place, but the food is marginal. Not sure why others rate it so highly. 

BF and I had the duck. It was good, but nothing special. I had the escargot...",3
88_DkUZQlKdFM4iXmK0KpA,L'Absinthe,3.9,102,"French, Modern European, Bistros, Bars",24 place du Marché Saint-Honoré,Paris,75001,We were recommended to go to dinner at this restaurant by Harry's New York Bar Paris (also an amazing place to go for a cocktail!). We didn't have...,5
88_DkUZQlKdFM4iXmK0KpA,L'Absinthe,3.9,102,"French, Modern European, Bistros, Bars",24 place du Marché Saint-Honoré,Paris,75001,We went there in April and it was one of the best if the no the best meal my husband and I had.  He still talks about the duck breast he had. It was totally...,5
88_DkUZQlKdFM4iXmK0KpA,L'Absinthe,3.9,102,"French, Modern European, Bistros, Bars",24 place du Marché Saint-Honoré,Paris,75001,What a great place! The service was great and the food delicious! The portions are large and we shared entrees!,5
88_DkUZQlKdFM4iXmK0KpA,L'Absinthe,3.9,102,"French, Modern European, Bistros, Bars",24 place du Marché Saint-Honoré,Paris,75001,"Amazing food and service, reasonably priced foe the quality. We will definitely be back",5
88_DkUZQlKdFM4iXmK0KpA,L'Absinthe,3.9,102,"French, Modern European, Bistros, Bars",24 place du Marché Saint-Honoré,Paris,75001,"One steak was good and the other was very fatty.  No frites, which was disappointing.  Wines offered were not great.",3
88_DkUZQlKdFM4iXmK0KpA,L'Absinthe,3.9,102,"French, Modern European, Bistros, Bars",24 place du Marché Saint-Honoré,Paris,75001,"Great restaurant in the 1er Arrondissement down in a warren of streets off the Rue St-Honore. I had gone (alone) without a booking, and was immediately...",4
88_DkUZQlKdFM4iXmK0KpA,L'Absinthe,3.9,102,"French, Modern European, Bistros, Bars",24 place du Marché Saint-Honoré,Paris,75001,This is a good spot in the 1st arr. We came here on our first night and had an enjoyable meal. The restaurant is located at the end of a strip with a lot of...,4
CQi4W2vY8KSiG6n24eaScA,Mystery Cuisine,4.9,17,French,37 Bis Rue De Montpensier,Paris,75001,Alors! I took my wife here to celebrate her 40th birthday on the 11th of July. This was a fantastic experience. The restaurant is very unassuming from the...,5
CQi4W2vY8KSiG6n24eaScA,Mystery Cuisine,4.9,17,French,37 Bis Rue De Montpensier,Paris,75001,"Enchanté, Mystery Cuisine!  I'm so disappointed that I don't live closer to a concept similar to yours.  WOW.

Not only did we have the whole restaurant to...",5
CQi4W2vY8KSiG6n24eaScA,Mystery Cuisine,4.9,17,French,37 Bis Rue De Montpensier,Paris,75001,My boyfriend booked a surprise dinner so I had no clue what we were walking into. I almost said no to the wine pairing because I can't handle that much...,5
CQi4W2vY8KSiG6n24eaScA,Mystery Cuisine,4.9,17,French,37 Bis Rue De Montpensier,Paris,75001,"A hidden gem, worth going for sure, an ambiance that's warm and romantic, food that is innovative and so tasty, topped with a warm eccentric service.",5
CQi4W2vY8KSiG6n24eaScA,Mystery Cuisine,4.9,17,French,37 Bis Rue De Montpensier,Paris,75001,The shear creativity in what's happening at Mystery Cuisine has me giving it 5 stars. I'm an artist at heart so the notion of presenting this dining...,5
CQi4W2vY8KSiG6n24eaScA,Mystery Cuisine,4.9,17,French,37 Bis Rue De Montpensier,Paris,75001,"The experience was... otherworldly!

Being 6'4"" and a Brit, I would never agree to sit to dine for almost 3hrs !
However, my wife and I were so thoroughly...",5
CQi4W2vY8KSiG6n24eaScA,Mystery Cuisine,4.9,17,French,37 Bis Rue De Montpensier,Paris,75001,"Extraordinary experience... Both the food and the setup of this wonderful little restaurant made this evening one to remember!!! 

I've been to many...",5
E1pcPLiXrTxujSWy-8P6vA,Bistrot du Centre,4.0,9,French,131 rue Saint-Martin,Paris,75004,"Truly lovely spot to get a drink on the patio. It is directly across the plaza from the Pompidour, which allows amazing people watching with a dramatic...",5
E1pcPLiXrTxujSWy-8P6vA,Bistrot du Centre,4.0,9,French,131 rue Saint-Martin,Paris,75004,"My Italien Burger was delicious, but my wife left half her breakfast on her plate which is rare.  The cafe is cozy and adjacent to the centre pompidou . . ....",4
E1pcPLiXrTxujSWy-8P6vA,Bistrot du Centre,4.0,9,French,131 rue Saint-Martin,Paris,75004,"As the name implies, this place is conveniently located just outside the Centre Pompidou, but luckily manages to avoid an overly touristy vibe. Food was...",4
4vYwg-bqxLQ0i7HYw6f0Wg,L'Annexe,4.5,47,French,13 rue Trois Frères,Paris,75018,"Friendly owner who speaks English, hallelujah! 

- located in the lovely Montmarte area
- if you can't speak or read French, no worries, simply flip over...",5
4vYwg-bqxLQ0i7HYw6f0Wg,L'Annexe,4.5,47,French,13 rue Trois Frères,Paris,75018,The food was fantastic! The service was some of the best we experienced while in Paris. Definitely someplace we will return to.,5
4vYwg-bqxLQ0i7HYw6f0Wg,L'Annexe,4.5,47,French,13 rue Trois Frères,Paris,75018,"Amazing, Authentic, and more please! Fantastic food, great wine, wonderful service. Highly recommend!",5
4vYwg-bqxLQ0i7HYw6f0Wg,L'Annexe,4.5,47,French,13 rue Trois Frères,Paris,75018,What a fantastic meal!  Their 3 course prix fixe for 39E is a great deal!  Everything we had was beautifully prepared and presented. The service was...,5
4vYwg-bqxLQ0i7HYw6f0Wg,L'Annexe,4.5,47,French,13 rue Trois Frères,Paris,75018,We arrived in the Montmartre neighborhood without any reservations and we were able to walk in at opening and be seated it did fill rather quickly. It only...,5
4vYwg-bqxLQ0i7HYw6f0Wg,L'Annexe,4.5,47,French,13 rue Trois Frères,Paris,75018,Found L'Annexe while wandering the neighborhood hoping to find solid French cuisine. We couldn't have been more pleased. One of our party has a decent ear...,5
4vYwg-bqxLQ0i7HYw6f0Wg,L'Annexe,4.5,47,French,13 rue Trois Frères,Paris,75018,An excellent dinner spot in Paris that deserves more attention and a closer look for visitors to the city. We dined here on Valentines Day and had a lovely...,4
BHKDMcw9EdJ9ldZva467jA,Les Foodies,4.6,12,"Italian, Mediterranean, French",6-8 square Sainte-Croix-de-la-Bretonnerie,Paris,75004,My wife and I enjoyed an intimate and absolutely delicious dining experience à Les Foodies. I have to admit that after many miles of walking around the...,5
BHKDMcw9EdJ9ldZva467jA,Les Foodies,4.6,12,"Italian, Mediterranean, French",6-8 square Sainte-Croix-de-la-Bretonnerie,Paris,75004,Les Foodies is a beautiful restaurant and the food is magnificent! The Oeuf Royal was amazing!  The staff was wonderful! I highly recommend Les Foodies!,5
BHKDMcw9EdJ9ldZva467jA,Les Foodies,4.6,12,"Italian, Mediterranean, French",6-8 square Sainte-Croix-de-la-Bretonnerie,Paris,75004,This place is amazing! We decided to have some french food and stumbled onto this place and the food was delicious! We had a party of five and each one...,5
BHKDMcw9EdJ9ldZva467jA,Les Foodies,4.6,12,"Italian, Mediterranean, French",6-8 square Sainte-Croix-de-la-Bretonnerie,Paris,75004,We stumbled onto this place after our first choice was closed.  What luck.  Opted to sit inside in the plush cobalt velvet chairs.  So comfy.  They were...,5
BHKDMcw9EdJ9ldZva467jA,Les Foodies,4.6,12,"Italian, Mediterranean, French",6-8 square Sainte-Croix-de-la-Bretonnerie,Paris,75004,"Just a great meal!!!  The waiter/sommelier is amazing!  The risotto and the duck is amazing, worth a trip here!!!",5
BHKDMcw9EdJ9ldZva467jA,Les Foodies,4.6,12,"Italian, Mediterranean, French",6-8 square Sainte-Croix-de-la-Bretonnerie,Paris,75004,This is a fantastic place for foodies. They know how to give a dining experience. Now food. They offers only three set menus for brunch. We have French...,5
BHKDMcw9EdJ9ldZva467jA,Les Foodies,4.6,12,"Italian, Mediterranean, French",6-8 square Sainte-Croix-de-la-Bretonnerie,Paris,75004,"I came here for their amazing lunch deal and while it was pretty affordable at 21 euros, the food was probably just a bit above average rather than the WOW...",4
2JpBWCr2q4934qvRK9WTEw,Carpe Diem Café,4.2,171,"French, Lounges, Cocktail Bars",21 rue des Halles,Paris,75001,Good food. Fast service. A little noisy. And a little chili because they keep the front door open.,4
2JpBWCr2q4934qvRK9WTEw,Carpe Diem Café,4.2,171,"French, Lounges, Cocktail Bars",21 rue des Halles,Paris,75001,Outstanding food and really nice people running this family-run restaurant . This is a small bistro style café right in the busy center of Paris. We loved...,5
2JpBWCr2q4934qvRK9WTEw,Carpe Diem Café,4.2,171,"French, Lounges, Cocktail Bars",21 rue des Halles,Paris,75001,"Wonderful food and drinks as well. Great service too. 
Well looked after as we sat outside for a bit waiting for a table and then had a wonderful dinner...",5
2JpBWCr2q4934qvRK9WTEw,Carpe Diem Café,4.2,171,"French, Lounges, Cocktail Bars",21 rue des Halles,Paris,75001,I was in town on business and looking for a place for a safe solo dinner near my hotel. This had good reviews so thought I would try it. They seated me in a...,2
2JpBWCr2q4934qvRK9WTEw,Carpe Diem Café,4.2,171,"French, Lounges, Cocktail Bars",21 rue des Halles,Paris,75001,"We returned back to the area near our apartment after the Seine Cruise. It was around 11 pm. A couple of restaurants were no longer serving food. By chance,...",5
2JpBWCr2q4934qvRK9WTEw,Carpe Diem Café,4.2,171,"French, Lounges, Cocktail Bars",21 rue des Halles,Paris,75001,"Service was amazing, probably the best I've ever had in Paris. Fun music and great happy hour deals.",5
2JpBWCr2q4934qvRK9WTEw,Carpe Diem Café,4.2,171,"French, Lounges, Cocktail Bars",21 rue des Halles,Paris,75001,Excellent service and delicious food. We were sorry to have found this place on the last day of our trip because we definitely would have ate there more...,5
4TZ92lo35VPqjrAvOVkQmQ,The Family,4.5,44,"French, Bistros",7 rue la Fayette,Paris,75009,We came for a small quick meal on a Saturday at around 5:00pm. We had the french onion soup and the burger. The french onion soup was very good. The Cheese...,4
4TZ92lo35VPqjrAvOVkQmQ,The Family,4.5,44,"French, Bistros",7 rue la Fayette,Paris,75009,"The service is fantastic and very English speaker friendly. Always a great steak with affordable, delicious wine pairings. 
The Family is a go to spot when...",5
4TZ92lo35VPqjrAvOVkQmQ,The Family,4.5,44,"French, Bistros",7 rue la Fayette,Paris,75009,Awesome food. Great and friendly service. Highly recommend trying the steak and the onion soup. The deviled eggs are amazing as well!,5
4TZ92lo35VPqjrAvOVkQmQ,The Family,4.5,44,"French, Bistros",7 rue la Fayette,Paris,75009,"What a little gem! Surprisingly good value considering the high traffic / touristy location, The Family is warm, cosy and welcoming with a great menu and...",5
4TZ92lo35VPqjrAvOVkQmQ,The Family,4.5,44,"French, Bistros",7 rue la Fayette,Paris,75009,"Food was great.  Service was even better.  It was a little warm inside for us, (US) but cooled off eventually.  Still, it was a great place to go near Gare...",5
4TZ92lo35VPqjrAvOVkQmQ,The Family,4.5,44,"French, Bistros",7 rue la Fayette,Paris,75009,The Tandoori salmon was some of the best salmon I've ever had. We were treated very well in a small space (that we found to be typical for Paris.) They...,4
4TZ92lo35VPqjrAvOVkQmQ,The Family,4.5,44,"French, Bistros",7 rue la Fayette,Paris,75009,Thank you fellow Yelp reviewers! Decided to come here based on your recommendations after shopping at Galeries Lafayette. It was just down the street....,5
Erdi9jgM4Wrw8e_uwTY47Q,Restaurant Georgette,4.6,41,"Brasseries, Modern European, French",44 rue d'Assas,Paris,75006,Lovely French restaurant for a slightly elevated yet not too fancy lunch or dinner. I ordered the Filet of Beef (€39)- the steak was great and cooked to a...,4
Erdi9jgM4Wrw8e_uwTY47Q,Restaurant Georgette,4.6,41,"Brasseries, Modern European, French",44 rue d'Assas,Paris,75006,"Service and food was outstanding. Vibe lovely. I highly recommend it. 
Why 3 stars? Well, I selected it because it had a 25 dollar prix fix lunch menu,...",3
Erdi9jgM4Wrw8e_uwTY47Q,Restaurant Georgette,4.6,41,"Brasseries, Modern European, French",44 rue d'Assas,Paris,75006,Great restaurant by the Jardin du Luxembourg. I sat outside and had a great time. I started with the shrimp appetizer which was my favorite thing I ate...,5
