business_id,name,rating,review_count,category,address,city,zip_code,review_text,review_rating
IOxTIGtrz8Dv8pdNP0n4Mg,Chez André,3.6,178,French,12 rue Marbeuf,Paris,75008,It's a lovely spot with delicious food and warm and friendly service. They have an extensive selection of seafoods. Trust their wine recommendations! Great...,5
IOxTIGtrz8Dv8pdNP0n4Mg,Chez André,3.6,178,French,12 rue Marbeuf,Paris,75008,"Pretty average. We arrived without a reservation and the host just kind of huffed. He looked around(we say lots of empty tables) and said ""let me see if I...",3
IOxTIGtrz8Dv8pdNP0n4Mg,Chez André,3.6,178,French,12 rue Marbeuf,Paris,75008,"This restaurant was recommended to us and we thought that we give it a try. Walked in around 1pm during a work day and the restaurant was pretty full, which...",3
IOxTIGtrz8Dv8pdNP0n4Mg,Chez André,3.6,178,French,12 rue Marbeuf,Paris,75008,Very rude waitress would not recommend she is only nice to people who speak french and mixed up the orders,1
IOxTIGtrz8Dv8pdNP0n4Mg,Chez André,3.6,178,French,12 rue Marbeuf,Paris,75008,"Our favorite dinner in Paris!! And cannot recommend enough! 

Though I had accidentally reserved for the next day (reservation requests made through email),...",5
IOxTIGtrz8Dv8pdNP0n4Mg,Chez André,3.6,178,French,12 rue Marbeuf,Paris,75008,"Family of 4, we had a wonderful dinner at Chez Andre. Sat outside and they brought us a couple of blankets. The kids meal include a cold Coca Cola and...",5
IOxTIGtrz8Dv8pdNP0n4Mg,Chez André,3.6,178,French,12 rue Marbeuf,Paris,75008,"This restaurant is not in the center of craziness which makes it a gem in the center tourist attractions. Food is great, fresh, tasty and on time. Servers...",5
ZsqtKRo1XCmFHd1udXz-Jg,Contre Allée,4.3,23,French,83 ave Denfert-Rochereau,Paris,75014,"Paris was so kind to us. Contre Allée was the last place we ate before coming home. 

My boyfriend and I had been hoping to see the famous Paris Catacombs...",5
ZsqtKRo1XCmFHd1udXz-Jg,Contre Allée,4.3,23,French,83 ave Denfert-Rochereau,Paris,75014,"Amazing food. The owners are so welcoming. The food is beyond description.
Everything was fresh and prepared when you order. I had the sea bass, phenomenal....",5
ZsqtKRo1XCmFHd1udXz-Jg,Contre Allée,4.3,23,French,83 ave Denfert-Rochereau,Paris,75014,This is a great place to eat! This was our first meal in Paris and it was awesome. Both servers were friendly and took time to explained the menu items. I...,5
ZsqtKRo1XCmFHd1udXz-Jg,Contre Allée,4.3,23,French,83 ave Denfert-Rochereau,Paris,75014,"Nice atmosphere,  great service,  very tasty food.   Butternut squash soup with roasted chestnuts was absolutely delicious.  Waitress made great wine...",4
ZsqtKRo1XCmFHd1udXz-Jg,Contre Allée,4.3,23,French,83 ave Denfert-Rochereau,Paris,75014,"best foie gras in town. really helpful and welcoming service, great wine list, reasonable prices.  loved this one.",5
cEixu9Rr6e7j5IIsspU9QQ,Le Prince Racine,4.4,23,"Cafes, Brasseries, French",22 rue Monsieur le Prince,Paris,75006,"We chose it because it was close, and am so glad we did. Warmly greeted and sat immediately. Felt like walking into a Hemingway East Indies French...",5
cEixu9Rr6e7j5IIsspU9QQ,Le Prince Racine,4.4,23,"Cafes, Brasseries, French",22 rue Monsieur le Prince,Paris,75006,"Great FO soup and flank steak. Tasty snails too. Ate twice on my trip, nice people/servers. Recommend if you are staying in the Latin Quarter",4
cEixu9Rr6e7j5IIsspU9QQ,Le Prince Racine,4.4,23,"Cafes, Brasseries, French",22 rue Monsieur le Prince,Paris,75006,"Great delicious food and wine with nice ambiance. Menus available in both English and French. We got escargot,  French onion soup, fresh barrata salad. Yum!",5
cEixu9Rr6e7j5IIsspU9QQ,Le Prince Racine,4.4,23,"Cafes, Brasseries, French",22 rue Monsieur le Prince,Paris,75006,"Food was great! I didn't expect too much as I walked by. The service was good. The ambiance was cozy and tight, but was a lovely place.

Both myself and my...",5
cEixu9Rr6e7j5IIsspU9QQ,Le Prince Racine,4.4,23,"Cafes, Brasseries, French",22 rue Monsieur le Prince,Paris,75006,"Stumbled across this cafe near the Latin Quarter and was looking for something to eat and drink, and it was perfect. The staff were friendly, the food was...",5
cEixu9Rr6e7j5IIsspU9QQ,Le Prince Racine,4.4,23,"Cafes, Brasseries, French",22 rue Monsieur le Prince,Paris,75006,Nice ambiance. Good service. Food is mediocre. Sauces/dressing tasted like it came out of a jar.,3
cEixu9Rr6e7j5IIsspU9QQ,Le Prince Racine,4.4,23,"Cafes, Brasseries, French",22 rue Monsieur le Prince,Paris,75006,"Efficient and professional staff serve good, but not great, food in an attractive, but crowded, restaurant.  The fish and chips were good if you like cod....",4
UlY1mOSqxTkeJVStZE-X0g,Canard et Champagne,4.4,40,"French, Champagne Bars",57 passage des Panoramas,Paris,75002,"First time in Paris and tryouts this restaurant , the food was excellent and the staff very friendly, I tried the same order at different restaurant but...",5
UlY1mOSqxTkeJVStZE-X0g,Canard et Champagne,4.4,40,"French, Champagne Bars",57 passage des Panoramas,Paris,75002,"Imagine stumbling into a passageway in Paris, and then imagine that passageway being lined with the most adorable restaurants and shops. That's where you'll...",5
UlY1mOSqxTkeJVStZE-X0g,Canard et Champagne,4.4,40,"French, Champagne Bars",57 passage des Panoramas,Paris,75002,This is a really popular place. It's in the Passage des Panoramas. The restaurant used to be a stationery shop. They only serve two things - duck and...,5
UlY1mOSqxTkeJVStZE-X0g,Canard et Champagne,4.4,40,"French, Champagne Bars",57 passage des Panoramas,Paris,75002,My favorite restaurant for duck breast in Paris. Can't wait to go back and celebrate my birthday there in March.,5
UlY1mOSqxTkeJVStZE-X0g,Canard et Champagne,4.4,40,"French, Champagne Bars",57 passage des Panoramas,Paris,75002,"Wow. Wow. Wow!!!! 

This place is unbelievable! The duck was cooked so well and delicious! 

Ordered a whole duck breast and a Demi size, the Demi was not...",5
UlY1mOSqxTkeJVStZE-X0g,Canard et Champagne,4.4,40,"French, Champagne Bars",57 passage des Panoramas,Paris,75002,Tucked away in a little alley way. We made reservations and got here a bit earlier and they'd at us right away. It did get pretty packed to try to make...,4
UlY1mOSqxTkeJVStZE-X0g,Canard et Champagne,4.4,40,"French, Champagne Bars",57 passage des Panoramas,Paris,75002,"This was truly one of my favorite food experiences in Paris (and that's saying a lot). I stumbled over it while searching Yelp, and it's a good thing--you'd...",5
nnAxF4EKaf7yLbLGxkShmQ,Le Calife,4.3,123,French,Port des Saints Pères,Paris,75006,"We had a spectacular experience with Le Calife. Yes, they are expensive than other dinner cruises around the area, but their service lives up to that...",5
nnAxF4EKaf7yLbLGxkShmQ,Le Calife,4.3,123,French,Port des Saints Pères,Paris,75006,Let me start by staying we had a great experience doing our dinner cruise with Le Calife. If you are coming to Paris it's a must for us and we did the Menu...,5
nnAxF4EKaf7yLbLGxkShmQ,Le Calife,4.3,123,French,Port des Saints Pères,Paris,75006,We tried this dinner cruise on the Seine and had an amazing time ! It's a very unique experience. Booked online. On arrival the interior of this Bateaux...,4
nnAxF4EKaf7yLbLGxkShmQ,Le Calife,4.3,123,French,Port des Saints Pères,Paris,75006,Excellent we love this place. Everything here is good. It's amazing. The burger was unbelievable.,4
nnAxF4EKaf7yLbLGxkShmQ,Le Calife,4.3,123,French,Port des Saints Pères,Paris,75006,"It was suppose to be one of the highlights of our trip.   It was prob the lowest.  By lowest, they sat us in the worst location on the boat.   Completely...",2
nnAxF4EKaf7yLbLGxkShmQ,Le Calife,4.3,123,French,Port des Saints Pères,Paris,75006,It was a cold and drizzly Saturday (Samedi) evening when we crossed Pont des Arts after exiting the Louvre metro station and descended the old world stone...,4
nnAxF4EKaf7yLbLGxkShmQ,Le Calife,4.3,123,French,Port des Saints Pères,Paris,75006,"La calife was a very memorable experience! Between floating on the Seine and ""our welcome glasses of champagne, we also purchased the a wine option which...",5
Ik6Mx89CMQXQJBhtTLK75w,L'Envie,4.6,27,French,57 rue Pernety,Paris,75014,"Little corner restaurant. We came by late at night looking for crème brûlée, and we were very pleased with what we got. It was delicious!! Customer service...",5
Ik6Mx89CMQXQJBhtTLK75w,L'Envie,4.6,27,French,57 rue Pernety,Paris,75014,We found this quiet local cafe near our hotel. Friendly helpful English speaking wait staff. One of the best onion soups we have tasted as well a nice steak...,4
Ik6Mx89CMQXQJBhtTLK75w,L'Envie,4.6,27,French,57 rue Pernety,Paris,75014,Fantastic service wine cocktails and menu. Confit canard et pommes as well as risotto truffe are excellent. Merci! Will return.,5
Ik6Mx89CMQXQJBhtTLK75w,L'Envie,4.6,27,French,57 rue Pernety,Paris,75014,This is the second visit to L'Envie. Each meal was SO good. I had the French Onion Soup the first visit. Then this evening I ordered the lentils with...,5
Ik6Mx89CMQXQJBhtTLK75w,L'Envie,4.6,27,French,57 rue Pernety,Paris,75014,"We stumbled across this place our first night in Paris. We just came in from London, wasn't super hungry but could use a snack and wine. The couple that I'm...",5
Ik6Mx89CMQXQJBhtTLK75w,L'Envie,4.6,27,French,57 rue Pernety,Paris,75014,"The owners are the sweetest, the food was good and we all had a great meal. My husband had the steak and I ordered the truffle risotto! I actually don't...",4
Ik6Mx89CMQXQJBhtTLK75w,L'Envie,4.6,27,French,57 rue Pernety,Paris,75014,"We stayed nearby and had our choice of at least 3 brasseries, more pizza places and kebab joints all within a block. We went here our first night after a...",5
6cb_0NPPnQLxZWcERj6NGw,Au Fil des Saisons,4.4,73,French,6 Rue Fontaines Du Temple,Paris,75003,"Nearly a year later. And we finally returned (from the US, not local). 

Service remains unmatched. The seared foie gras was absolutely next level. Steak...",5
6cb_0NPPnQLxZWcERj6NGw,Au Fil des Saisons,4.4,73,French,6 Rue Fontaines Du Temple,Paris,75003,"We made last minute reservations here for dinner. 
The owner was short staffed so the wait was ling but he was very apologetic for it, service was very...",4
6cb_0NPPnQLxZWcERj6NGw,Au Fil des Saisons,4.4,73,French,6 Rue Fontaines Du Temple,Paris,75003,"Thanks to some online research and Yelp reviews, we found this place during a downpour evening and the place was packed! It was filled with locals and very...",5
6cb_0NPPnQLxZWcERj6NGw,Au Fil des Saisons,4.4,73,French,6 Rue Fontaines Du Temple,Paris,75003,Service was slow because the proprietor had no help but he is quite friendly. The food was superior to most everything we have had here in Paris. We plan on...,5
6cb_0NPPnQLxZWcERj6NGw,Au Fil des Saisons,4.4,73,French,6 Rue Fontaines Du Temple,Paris,75003,"Friendly, small restaurant in walking distance from the Marais and Louvre. Only 24 seats...reservations required w credit card guarantee.

I started w a...",5
6cb_0NPPnQLxZWcERj6NGw,Au Fil des Saisons,4.4,73,French,6 Rue Fontaines Du Temple,Paris,75003,We came to this place looking for another one and it was AMAZING. The food is so well prepared! Top quality french cuisine. The chef and owner was so...,5
6cb_0NPPnQLxZWcERj6NGw,Au Fil des Saisons,4.4,73,French,6 Rue Fontaines Du Temple,Paris,75003,"I'm in love! The food, the ambiance, the owner who serves all of his guests hearty portions of beautifully crafted, delicious French food leaves absolutely...",5
-sggfLHsfPbgXw5S6a7Jdg,Juvéniles,4.2,73,"French, Wine Bars",47 rue de Richelieu,Paris,75001,"Delicious! Everything was great.
Cheese plate, risotto, and dessert were all fantastic.

Service was superb.

It was calm, dim, and cozy.
 
I would...",5
-sggfLHsfPbgXw5S6a7Jdg,Juvéniles,4.2,73,"French, Wine Bars",47 rue de Richelieu,Paris,75001,Juveniles is near the Louvre and Notre Dame and is a great place to get food and wine. We had their short rib served in a puree sauce that enhanced its...,4
-sggfLHsfPbgXw5S6a7Jdg,Juvéniles,4.2,73,"French, Wine Bars",47 rue de Richelieu,Paris,75001,Our meal was yummy- this as our last night in Paris. Make a reservation- this place seats maybe 25 people. Hubby had beef cheek and I had their scallop...,5
-sggfLHsfPbgXw5S6a7Jdg,Juvéniles,4.2,73,"French, Wine Bars",47 rue de Richelieu,Paris,75001,Nice small restaurant in a busy Parisian neighborhood.   Started with a nice cold bottle of Chablis to put us at ease.   We ordered the special starter of...,5
-sggfLHsfPbgXw5S6a7Jdg,Juvéniles,4.2,73,"French, Wine Bars",47 rue de Richelieu,Paris,75001,"Had a wonderful and surprising meal here on Bastille Day for lunch. It wasn't what I typically thing of when thinking French food but in terms of freshness,...",5
-sggfLHsfPbgXw5S6a7Jdg,Juvéniles,4.2,73,"French, Wine Bars",47 rue de Richelieu,Paris,75001,Such a let down. Was recommended by several blogs and I worked HARD to get a reservation. Service was okay and the food was below average and not cheap....,3
-sggfLHsfPbgXw5S6a7Jdg,Juvéniles,4.2,73,"French, Wine Bars",47 rue de Richelieu,Paris,75001,Favorite Parisian meal from our two trips in the last few years. We had lunch in the small space which looked tight with the full house but still felt...,5
XWBzlpJcZnLgXCuIWDNDGQ,Le Pavillon,4.3,31,French,53 bis avenue de la Motte Picquet,Paris,75015,Everything was delicious I was hesitant to try escargot but this place prepared them so good.,5
XWBzlpJcZnLgXCuIWDNDGQ,Le Pavillon,4.3,31,French,53 bis avenue de la Motte Picquet,Paris,75015,"Good food.

Fine service, albeit they were very busy on a Friday night.

The pasta cream truffle ""risotto"" was absolutely delicious.

Drinks were...",4
XWBzlpJcZnLgXCuIWDNDGQ,Le Pavillon,4.3,31,French,53 bis avenue de la Motte Picquet,Paris,75015,Been going to this wonderful hotel for years and the reason I do it is because of the friendly professionals who work there. They make my stay a family...,5
XWBzlpJcZnLgXCuIWDNDGQ,Le Pavillon,4.3,31,French,53 bis avenue de la Motte Picquet,Paris,75015,Service was fabulous! Food was fantastic! Wine was out of this world (coming from California). Very grateful for the experience.,5
XWBzlpJcZnLgXCuIWDNDGQ,Le Pavillon,4.3,31,French,53 bis avenue de la Motte Picquet,Paris,75015,Very friendly service and a great meal from pate to lamb and tzaziki. Accommodated us as much as possible.,5
XWBzlpJcZnLgXCuIWDNDGQ,Le Pavillon,4.3,31,French,53 bis avenue de la Motte Picquet,Paris,75015,Wrong business. Its a new one called Pavillion. The yelp reviews are out of date. Different food different style.,1
XWBzlpJcZnLgXCuIWDNDGQ,Le Pavillon,4.3,31,French,53 bis avenue de la Motte Picquet,Paris,75015,"Excellent service, very friendly, food was very very good, the atmosphere was great, relaxing, quite near the Eiffel Tower.",4
XrDNvRVXmYXrYTLZZzJyow,Les Résistants,4.7,12,French,16-18 rue du Château d'Eau,Paris,75010,We were staying in the area and didn't know where to eat on our first night. This restaurant was down the block from our hotel and had good reviews. We...,4
XrDNvRVXmYXrYTLZZzJyow,Les Résistants,4.7,12,French,16-18 rue du Château d'Eau,Paris,75010,This was our 1st meal in Paris on our 3rd visit.  As usual the food in Paris never disappoints me.  What I really enjoyed was how well prepared the...,4
XrDNvRVXmYXrYTLZZzJyow,Les Résistants,4.7,12,French,16-18 rue du Château d'Eau,Paris,75010,I didn't have a reservation but they sat me nonetheless. Service was superb the food was even better. I'm only sorry I couldn't get back for a second time...,5
XrDNvRVXmYXrYTLZZzJyow,Les Résistants,4.7,12,French,16-18 rue du Château d'Eau,Paris,75010,Requested a lunch reservation Monday night for a 12pm slot on Tuesday. It was confirmed by email right away Tuesday morning! Though a reservation might not...,5
XrDNvRVXmYXrYTLZZzJyow,Les Résistants,4.7,12,French,16-18 rue du Château d'Eau,Paris,75010,"This is an interesting and different sort of restaurant.  Let me start by saying that the food was OUTSTANDING!  For the price, you will not get a better...",4
XrDNvRVXmYXrYTLZZzJyow,Les Résistants,4.7,12,French,16-18 rue du Château d'Eau,Paris,75010,This place is AMAZING. I love it so much and I only wish I had more time to visit this spot more. My boyfriend and I came for lunch on a weekday and brunch...,5
XrDNvRVXmYXrYTLZZzJyow,Les Résistants,4.7,12,French,16-18 rue du Château d'Eau,Paris,75010,Honestly some of the best food and BEST service we recieved while in Paris. The hostess was one of the nicest parisians I've ever met and the waiter was...,5
voGCw_SPTMBcCa59v41YRA,La Cave à Vin,4.4,9,"French, Beer, Wine & Spirits",7 rue de l'Epée de Bois,Paris,75005,"Each visit to this restaurant has been an absolute pleasure.
They make you feel very welcome and the service is friendly and intimate.. as the dude crouches...",5
voGCw_SPTMBcCa59v41YRA,La Cave à Vin,4.4,9,"French, Beer, Wine & Spirits",7 rue de l'Epée de Bois,Paris,75005,"Looking forward to a great lunch, we were disappointed as their kitchen is closed until September (the owner'S wife/cook is expecting and away).",3
food1gFiHSW3h3IdAsEoXA,Le Plomb du Cantal,4.1,13,French,5 rue du Maine,Paris,75014,"As advertised. Aligot excellent. Sausage stuffed cabbage good. The American ""meat loaf"" consistency paired perfectly with the aligot. Steak average. Waiter...",4
food1gFiHSW3h3IdAsEoXA,Le Plomb du Cantal,4.1,13,French,5 rue du Maine,Paris,75014,"Very good food great service and nice ambiance 
One of the best restaurants  in Paris",5
food1gFiHSW3h3IdAsEoXA,Le Plomb du Cantal,4.1,13,French,5 rue du Maine,Paris,75014,"Toughest ribeye I've ever had. Of the 400 grams, about 250 grams might have been edible. My knife thanked me when I have up. Very disappointed.",3
food1gFiHSW3h3IdAsEoXA,Le Plomb du Cantal,4.1,13,French,5 rue du Maine,Paris,75014,"We have walked by this place many times and finally managed to come.

The food was very good.  Very French food.  They make  their house specialty which is...",4
food1gFiHSW3h3IdAsEoXA,Le Plomb du Cantal,4.1,13,French,5 rue du Maine,Paris,75014,"Probably one of the worst French ""country"" restaurants in Paris. Good for drinks but definitely not for steak unless you want to eat through a bike tire....",1
food1gFiHSW3h3IdAsEoXA,Le Plomb du Cantal,4.1,13,French,5 rue du Maine,Paris,75014,"Ordered the aliglot and beef dish - HUGE PORTIONS - BEWARE if you are not hungry. Aliglot was that delicious, buttery, soft, garlicky potato you probably...",4
food1gFiHSW3h3IdAsEoXA,Le Plomb du Cantal,4.1,13,French,5 rue du Maine,Paris,75014,This place is great. Got duck confit and chou with aligot. The aligot was incredible. Good food. Good service. Good wine. Loved it.,5
U8zqTmQDXx7lDH9Tra7THw,Chez Francis,2.8,210,"Brasseries, French",7 place de l'Alma,Paris,75008,"We stayed the Paris Marriott Opera Ambassador Hotel, the Concierges Dylan recommended Chez Francoise.
Dylan made our dinner reservations and requested the...",5
U8zqTmQDXx7lDH9Tra7THw,Chez Francis,2.8,210,"Brasseries, French",7 place de l'Alma,Paris,75008,"Very stylish location with great views of the tower and river. 

We came as a group and ordered several appetizers; snails, fois gras, onion soup and shrimp...",3
U8zqTmQDXx7lDH9Tra7THw,Chez Francis,2.8,210,"Brasseries, French",7 place de l'Alma,Paris,75008,"Beautiful cafe near the Eifel Tower. Ambiance was great and super Parisian! We had french onion soup, wine and tiramisu to end the night. If I am ever in...",5
U8zqTmQDXx7lDH9Tra7THw,Chez Francis,2.8,210,"Brasseries, French",7 place de l'Alma,Paris,75008,I booked a reservation here as it met my requirement for Eiffel Tower night viewing on our last night in Paris and also had a menu that could accommodate a...,3
U8zqTmQDXx7lDH9Tra7THw,Chez Francis,2.8,210,"Brasseries, French",7 place de l'Alma,Paris,75008,This restaurant's main draw is the location and a beautiful view of Eifel Tower! We were not expecting a gourmet experience or authentic Parisian vibe! This...,3
U8zqTmQDXx7lDH9Tra7THw,Chez Francis,2.8,210,"Brasseries, French",7 place de l'Alma,Paris,75008,This restaurant has beautiful views of the Eiffel Tower with lots of outdoor seating options. I think usually a reservation would be required but we got...,4
U8zqTmQDXx7lDH9Tra7THw,Chez Francis,2.8,210,"Brasseries, French",7 place de l'Alma,Paris,75008,"We tried the food it was amazing food
The service is kind sweet amazing 
We got the view of the Eiffel tower and we saw it lit up I live this place",5
lvP5_4OHw_tdo_gqfXViig,Les Arlots,4.7,23,French,136 rue Faubourg Poissonnière,Paris,75010,"If you would like to try the real bistro experience, you'll need to come here.  It's a small place, so you must call ahead to make reservations.  I actually...",5
lvP5_4OHw_tdo_gqfXViig,Les Arlots,4.7,23,French,136 rue Faubourg Poissonnière,Paris,75010,"Fun, relaxed, delicious, easy going, quite the perfect bistro! Food and wine here leaves you wanting more. Just go.",5
lvP5_4OHw_tdo_gqfXViig,Les Arlots,4.7,23,French,136 rue Faubourg Poissonnière,Paris,75010,"Les Arlots is one of my favorite restaurants in Paris right now. The atmosphere is small and cozy just like you want a French restaurant to be, and the...",5
lvP5_4OHw_tdo_gqfXViig,Les Arlots,4.7,23,French,136 rue Faubourg Poissonnière,Paris,75010,Absolutely amazing! We went to various Michelin starred restaurants and bistros in Paris and this was by far the best meal we had.  Food well seasoned not...,5
lvP5_4OHw_tdo_gqfXViig,Les Arlots,4.7,23,French,136 rue Faubourg Poissonnière,Paris,75010,"Anyone who doesn't like the restaurant is a hater. The service, staff, and food are a notch above. 

I ordered a steak and my partner got the pork sausage....",5
lvP5_4OHw_tdo_gqfXViig,Les Arlots,4.7,23,French,136 rue Faubourg Poissonnière,Paris,75010,Came for lunch and ate all 4 appetizers and both main courses. Everything was amazing. Extremely well put together dining experience in a casual format. The...,5
lvP5_4OHw_tdo_gqfXViig,Les Arlots,4.7,23,French,136 rue Faubourg Poissonnière,Paris,75010,Just as excellent this time as the last time I was here. The sausage with the potatoes is absolutely amazing. Intense. You might think that mash potatoes...,5
Le8BYtqQ8eZkq0EhFCHc_g,La Maison Bleue,4.4,48,"Bistros, French, Breakfast & Brunch",7 place Franz Liszt,Paris,75010,Great little spot right off Poissoinierre and Rue Lafayette near our rented apartment.  It has great reviews on The Fork so our group of 8 made a rezzy thru...,5
Le8BYtqQ8eZkq0EhFCHc_g,La Maison Bleue,4.4,48,"Bistros, French, Breakfast & Brunch",7 place Franz Liszt,Paris,75010,"If you're seeking to get your feet wet in Paris on your first few nights you CANNOT go wrong at Maison Bleue. All the team are friendly, kind and...",4
Le8BYtqQ8eZkq0EhFCHc_g,La Maison Bleue,4.4,48,"Bistros, French, Breakfast & Brunch",7 place Franz Liszt,Paris,75010,"Came here for dinner on my first night in Paris, France and was blown away with how delicious every thing was! We had the octopus, chicken and duck as...",5
Le8BYtqQ8eZkq0EhFCHc_g,La Maison Bleue,4.4,48,"Bistros, French, Breakfast & Brunch",7 place Franz Liszt,Paris,75010,"Arriving in Paris, my family and I were exhausted from all the traveling. After a search through some reviews, we settled on this place that was just a...",5
Le8BYtqQ8eZkq0EhFCHc_g,La Maison Bleue,4.4,48,"Bistros, French, Breakfast & Brunch",7 place Franz Liszt,Paris,75010,"Amazing, delicious food. We have been in France  two weeks and finally found the authentic French cuisine we were craving! Highly recommend!!!!",5
Le8BYtqQ8eZkq0EhFCHc_g,La Maison Bleue,4.4,48,"Bistros, French, Breakfast & Brunch",7 place Franz Liszt,Paris,75010,"Lovely corner cafe, opposite a church.  Plenty of outside seating.  The food is good but it was hard to enjoy when there were smokers outside.  Staff were...",4
Le8BYtqQ8eZkq0EhFCHc_g,La Maison Bleue,4.4,48,"Bistros, French, Breakfast & Brunch",7 place Franz Liszt,Paris,75010,"A great place.   Alert, friendly service with excellent English.  Main courses are excellent and original.   Charming low-key design.  A highlight of our...",5
vAfDke0aeT1tNnpKu4-UrA,Frame,3.0,67,"Bars, American, French",28 rue Jean Rey,Paris,75015,We came to Fame (located inside the Pullman hotel) mainly because it was one of the few restaurants with a nice view of the Effie Tower that had open...,3
vAfDke0aeT1tNnpKu4-UrA,Frame,3.0,67,"Bars, American, French",28 rue Jean Rey,Paris,75015,"We had a lovely dinner at our hotel ( the Pullman) where this lovely restaurant is located. I would highly recommend to stop here, as the food was overall...",5
vAfDke0aeT1tNnpKu4-UrA,Frame,3.0,67,"Bars, American, French",28 rue Jean Rey,Paris,75015,"We dined here twice, once for a quick and small dinner, and later for the breakfast buffet that is free to hotel guests. The dinner menu is a bit on the...",4
vAfDke0aeT1tNnpKu4-UrA,Frame,3.0,67,"Bars, American, French",28 rue Jean Rey,Paris,75015,"The atmosphere borders on sterile but food and service at lunch were very good. The Vitality pre-fixe menu was excellent, and reasonably priced at 42 euros,...",4
vAfDke0aeT1tNnpKu4-UrA,Frame,3.0,67,"Bars, American, French",28 rue Jean Rey,Paris,75015,"2.5 stars if I could. I saw another Yelper saying that you will watch everyone else get food before yours, and this is exactly what happened. We were the...",3
vAfDke0aeT1tNnpKu4-UrA,Frame,3.0,67,"Bars, American, French",28 rue Jean Rey,Paris,75015,We stopped in for a quick lunch during the Olympic Games are we were thrilled to find this jewel.  I had the best salad of my life.  Very friendly staff,4
